Sheet: Sheet1
A1: distance readings from L’Enfant orginal layout of DC (printout)
J2: feet conv | K2: measured@16
A3: streets | B3: 19 | C3: 17 | D3: 16 | E3: 15 | F3: 13 | G3: 10 | H3: AVG | I3: golden | J3: 63.5 | P3: rods
A4: P-N | B4: 14 | C4: 14.1 | D4: 14.1 | E4: 14.2 | F4: 14.4 | H4: of:=AVERAGE([.B4:.G4]) -> 14.16 | I4: of:=[.H4]*1.619 -> 22.92504 | J4: of:=[.J$3]*[.H4] -> 899.16 | K4: 875.5 | L4: of:=[.K4]/[.D4] -> 62.0921985815603 | M4: of:=([.J4]-[.K4])/[.K4] -> 0.0270245573957738 | N4: of:=27.3*[.J3] -> 1733.55 | P4: of:=[.J4]/16.5 -> 54.4945454545455 | Q4: of:=[.K4]/16.5 -> 53.0606060606061
A5: N-M | B5: 9.4 | C5: 9.7 | D5: 9.6 | E5: 9.8 | F5: 9.6 | G5: 9.5 | H5: of:=AVERAGE([.B5:.G5]) -> 9.6 | I5: of:=[.H5]*1.619 -> 15.5424 | J5: of:=[.J$3]*[.H5] -> 609.6 | K5: 578.1 | L5: of:=[.K5]/[.D5] -> 60.21875 | M5: of:=([.J5]-[.K5])/[.K5] -> 0.054488842760768 | P5: of:=[.J5]/16.5 -> 36.9454545454545 | Q5: of:=[.K5]/16.5 -> 35.0363636363636
A6: M-L’ | G6: 8 | H6: of:=AVERAGE([.B6:.G6]) -> 8 | I6: of:=[.H6]*1.619 -> 12.952 | J6: of:=[.J$3]*[.H6] -> 508 | L6: of:=[.K6]/[.D6] ->  | M6: of:=([.J6]-[.K6])/[.K6] ->  | P6: of:=[.J6]/16.5 -> 30.7878787878788 | Q6: of:=[.K6]/16.5 -> 0
A7: M-L | B7: 10.7 | C7: 10.4 | D7: 10.6 | E7: 10.3 | F7: 10.5 | H7: of:=AVERAGE([.B7:.G7]) -> 10.5 | I7: of:=[.H7]*1.619 -> 16.9995 | J7: of:=[.J$3]*[.H7] -> 666.75 | K7: 700 | L7: of:=[.K7]/[.D7] -> 66.0377358490566 | M7: of:=([.J7]-[.K7])/[.K7] -> -0.0475 | P7: of:=[.J7]/16.5 -> 40.4090909090909 | Q7: of:=[.K7]/16.5 -> 42.4242424242424
A8: L’-K | G8: 9 | H8: of:=AVERAGE([.B8:.G8]) -> 9 | I8: of:=[.H8]*1.619 -> 14.571 | J8: of:=[.J$3]*[.H8] -> 571.5 | L8: of:=[.K8]/[.D8] ->  | M8: of:=([.J8]-[.K8])/[.K8] ->  | P8: of:=[.J8]/16.5 -> 34.6363636363636 | Q8: of:=[.K8]/16.5 -> 0
A9: L-K | B9: 6.5 | C9: 6.8 | D9: 6.5 | E9: 6.7 | F9: 6.6 | H9: of:=AVERAGE([.B9:.G9]) -> 6.62 | I9: of:=[.H9]*1.619 -> 10.71778 | J9: of:=[.J$3]*[.H9] -> 420.37 | K9: 442 | L9: of:=[.K9]/[.D9] -> 68 | M9: of:=([.J9]-[.K9])/[.K9] -> -0.0489366515837104 | P9: of:=[.J9]/16.5 -> 25.4769696969697 | Q9: of:=[.K9]/16.5 -> 26.7878787878788
A10: K-I’ | B10: 6.7 | C10: 6.6 | D10: 6.8 | E10: 6.5 | F10: 6.4 | H10: of:=AVERAGE([.B10:.G10]) -> 6.6 | I10: of:=[.H10]*1.619 -> 10.6854 | J10: of:=[.J$3]*[.H10] -> 419.1 | K10: 431 | L10: of:=[.K10]/[.D10] -> 63.3823529411765 | M10: of:=([.J10]-[.K10])/[.K10] -> -0.0276102088167054 | P10: of:=[.J10]/16.5 -> 25.4 | Q10: of:=[.K10]/16.5 -> 26.1212121212121
A11: K-I | G11: 9 | H11: of:=AVERAGE([.B11:.G11]) -> 9 | I11: of:=[.H11]*1.619 -> 14.571 | J11: of:=[.J$3]*[.H11] -> 571.5 | L11: of:=[.K11]/[.D11] ->  | M11: of:=([.J11]-[.K11])/[.K11] ->  | P11: of:=[.J11]/16.5 -> 34.6363636363636 | Q11: of:=[.K11]/16.5 -> 0
A12: I’-H’ | B12: 6.5 | C12: 6.5 | D12: 6.4 | E12: 6.6 | F12: 6.6 | H12: of:=AVERAGE([.B12:.G12]) -> 6.52 | I12: of:=[.H12]*1.619 -> 10.55588 | J12: of:=[.J$3]*[.H12] -> 414.02 | K12: 414 | L12: of:=[.K12]/[.D12] -> 64.6875 | M12: of:=([.J12]-[.K12])/[.K12] -> 0.0000483091787440547 | P12: of:=[.J12]/16.5 -> 25.0921212121212 | Q12: of:=[.K12]/16.5 -> 25.0909090909091
A13: I-H | G13: 6.6 | H13: of:=AVERAGE([.B13:.G13]) -> 6.6 | I13: of:=[.H13]*1.619 -> 10.6854 | J13: of:=[.J$3]*[.H13] -> 419.1 | L13: of:=[.K13]/[.D13] ->  | M13: of:=([.J13]-[.K13])/[.K13] ->  | P13: of:=[.J13]/16.5 -> 25.4 | Q13: of:=[.K13]/16.5 -> 0
A14: H’-G | B14: 11 | C14: 11 | D14: 11.2 | E14: 11.1 | F14: 11 | H14: of:=AVERAGE([.B14:.G14]) -> 11.06 | I14: of:=[.H14]*1.619 -> 17.90614 | J14: of:=[.J$3]*[.H14] -> 702.31 | K14: 700 | L14: of:=[.K14]/[.D14] -> 62.5 | M14: of:=([.J14]-[.K14])/[.K14] -> 0.00329999999999992 | P14: of:=[.J14]/16.5 -> 42.5642424242424 | Q14: of:=[.K14]/16.5 -> 42.4242424242424
A15: H-G | G15: 8.6 | H15: of:=AVERAGE([.B15:.G15]) -> 8.6 | I15: of:=[.H15]*1.619 -> 13.9234 | J15: of:=[.J$3]*[.H15] -> 546.1 | L15: of:=[.K15]/[.D15] ->  | M15: of:=([.J15]-[.K15])/[.K15] ->  | P15: of:=[.J15]/16.5 -> 33.0969696969697 | Q15: of:=[.K15]/16.5 -> 0
A16: G-F | B16: 5.5 | C16: 5.5 | D16: 5.5 | E16: 5.6 | F16: 5.5 | G16: 5.7 | H16: of:=AVERAGE([.B16:.G16]) -> 5.55 | I16: of:=[.H16]*1.619 -> 8.98545 | J16: of:=[.J$3]*[.H16] -> 352.425 | K16: 352 | L16: of:=[.K16]/[.D16] -> 64 | M16: of:=([.J16]-[.K16])/[.K16] -> 0.0012073863636364 | P16: of:=[.J16]/16.5 -> 21.3590909090909 | Q16: of:=[.K16]/16.5 -> 21.3333333333333
A17: F-E | E17: 4.8 | F17: 4.5 | G17: 4.7 | H17: of:=AVERAGE([.B17:.G17]) -> 4.66666666666667 | I17: of:=[.H17]*1.619 -> 7.55533333333333 | J17: of:=[.J$3]*[.H17] -> 296.333333333333 | L17: of:=[.K17]/[.D17] ->  | M17: of:=([.J17]-[.K17])/[.K17] ->  | P17: of:=[.J17]/16.5 -> 17.9595959595959 | Q17: of:=[.K17]/16.5 -> 0
A18: E-D | E18: 7.9 | F18: 8 | G18: 7.9 | H18: of:=AVERAGE([.B18:.G18]) -> 7.93333333333333 | I18: of:=[.H18]*1.619 -> 12.8440666666667 | J18: of:=[.J$3]*[.H18] -> 503.766666666667 | L18: of:=[.K18]/[.D18] ->  | M18: of:=([.J18]-[.K18])/[.K18] ->  | P18: of:=[.J18]/16.5 -> 30.5313131313132 | Q18: of:=[.K18]/16.5 -> 0
H19: of:=MIN([.H5:.H18]) -> 4.66666666666667 | I19: min | L19: of:=AVERAGE([.L4];[.L5];[.L7];[.L9];[.L10];[.L12];[.L14];[.L16]) -> 63.8648171714742 | M19: of:=AVERAGE([.M4];[.M5];[.M7];[.M9];[.M10];[.M12];[.M14];[.M16]) -> -0.0047472205876867
H20: of:=MAX([.H4:.H18]) -> 14.16 | I20: max
B21: standardized | C21: diff steps | D21: 1.4 | E21: computed | F21: error | G21: golden A | H21: golden B
B22: 4.7 | D22: of:=ROUND([.B22]/[.D$21];0) -> 3 | E22: of:=[.D22]*[.D$21] -> 4.2 | F22: of:=([.B22]-[.E22])/[.B22] -> 0.106382978723404 | G22: of:=[.E22]/1.618 -> 2.59579728059332 | H22: of:=[.E22]*1.618 -> 6.7956
B23: 5.6 | C23: of:=[.B23]-[.B22] -> 0.9 | D23: of:=ROUND([.B23]/[.D$21];0) -> 4 | E23: of:=[.D23]*[.D$21] -> 5.6 | F23: of:=([.B23]-[.E23])/[.B23] -> 0 | G23: of:=[.E23]/1.618 -> 3.4610630407911 | H23: of:=[.E23]*1.618 -> 9.0608
B24: 6.6 | C24: of:=[.B24]-[.B23] -> 1 | D24: of:=ROUND([.B24]/[.D$21];0) -> 5 | E24: of:=[.D24]*[.D$21] -> 7 | F24: of:=([.B24]-[.E24])/[.B24] -> -0.0606060606060607 | G24: of:=[.E24]/1.618 -> 4.32632880098888 | H24: of:=[.E24]*1.618 -> 11.326
B25: 8 | C25: of:=[.B25]-[.B24] -> 1.4 | D25: of:=ROUND([.B25]/[.D$21];0) -> 6 | E25: of:=[.D25]*[.D$21] -> 8.4 | F25: of:=([.B25]-[.E25])/[.B25] -> -0.0499999999999998 | G25: of:=[.E25]/1.618 -> 5.19159456118665 | H25: of:=[.E25]*1.618 -> 13.5912
B26: 8.6 | C26: of:=[.B26]-[.B25] -> 0.6 | D26: of:=ROUND([.B26]/[.D$21];0) -> 6 | E26: of:=[.D26]*[.D$21] -> 8.4 | F26: of:=([.B26]-[.E26])/[.B26] -> 0.0232558139534885 | G26: of:=[.E26]/1.618 -> 5.19159456118665 | H26: of:=[.E26]*1.618 -> 13.5912
B27: 9 | C27: of:=[.B27]-[.B26] -> 0.4 | D27: of:=ROUND([.B27]/[.D$21];0) -> 6 | E27: of:=[.D27]*[.D$21] -> 8.4 | F27: of:=([.B27]-[.E27])/[.B27] -> 0.0666666666666668 | G27: of:=[.E27]/1.618 -> 5.19159456118665 | H27: of:=[.E27]*1.618 -> 13.5912
B28: 9.6 | C28: of:=[.B28]-[.B27] -> 0.6 | D28: of:=ROUND([.B28]/[.D$21];0) -> 7 | E28: of:=[.D28]*[.D$21] -> 9.8 | F28: of:=([.B28]-[.E28])/[.B28] -> -0.0208333333333333 | G28: of:=[.E28]/1.618 -> 6.05686032138443 | H28: of:=[.E28]*1.618 -> 15.8564
B29: 10.5 | C29: of:=[.B29]-[.B28] -> 0.9 | D29: of:=ROUND([.B29]/[.D$21];0) -> 8 | E29: of:=[.D29]*[.D$21] -> 11.2 | F29: of:=([.B29]-[.E29])/[.B29] -> -0.0666666666666666 | G29: of:=[.E29]/1.618 -> 6.9221260815822 | H29: of:=[.E29]*1.618 -> 18.1216
B30: 11.1 | C30: of:=[.B30]-[.B29] -> 0.6 | D30: of:=ROUND([.B30]/[.D$21];0) -> 8 | E30: of:=[.D30]*[.D$21] -> 11.2 | F30: of:=([.B30]-[.E30])/[.B30] -> -0.00900900900900898 | G30: of:=[.E30]/1.618 -> 6.9221260815822 | H30: of:=[.E30]*1.618 -> 18.1216
B31: 14.2 | C31: of:=[.B31]-[.B30] -> 3.1 | D31: of:=ROUND([.B31]/[.D$21];0) -> 10 | E31: of:=[.D31]*[.D$21] -> 14 | F31: of:=([.B31]-[.E31])/[.B31] -> 0.0140845070422535 | G31: of:=[.E31]/1.618 -> 8.65265760197775 | H31: of:=[.E31]*1.618 -> 22.652
F32: of:=AVERAGE([.F22:.F31]) -> 0.000327489677074391

Sheet: Sheet2
A1: Pierre Charles L'Enfant, dotted line map of Washington, D.C., 1791, before Aug. 19th.
A2: https://lccn.loc.gov/88694203
A4: Surveyor’s Layout Instructions
A5: Copyright © 2021, by Christopher A. Mosher, Shelton, Connecticut, USA.
A7: values in bold type indicate definitions of points or streets
A8: numbered streets are West (unless specified as East)
A9: lettered streets are North
F12: to point/define street/etc.
B13: position White House W atop hill at Beall’s Levels (with view down Potomac River) | D13: 38.897957 | E13: -77.03656 | F13: W
B14: position Capitol Building C atop Jenkin’s Hill (with view down Potomac River) | D14: 38.889809 | E14: -77.009062 | F14: C
B15: define width of buildings b as 160 feet | F15: b
B17: starting point/though point 1 | C17: end point/through point 2 | D17: heading | E17: distance
B18: C | D18: N/S | E18: full | F18: Capitol Av (N/S)
B19: C | D19: E/W | E19: full | F19: Capitol Av (E/W)
B20: W | D20: N/S | E20: full | F20: 16th St
B21: Jefferson Pier J due S of W and due W of C | F21: J
B23: C | D23: E | E23: ½b | F23: Ce
B24: C | D24: W | E24: ½b | F24: Cw
B25: W | D25: N | E25: ½b | F25: Wn
B26: W | D26: S | E26: ½b | F26: Ws
B28: mid J,Cw | D28: N/S | E28: full | F28: 8th St
B30: Ws | D30: E/W | E30: full | F30: F St
B32: Ws | C32: Cw | D32: [S 70 E] | E32: Ws-Cw | F32: PA Av (mid)
B33: Ws | D33: S 70 W | E33: full | F33: NY Av (west)
B34: Cw | D34: S 70 W | E34: full | F34: MD Av (west)
B35: J | D35: S 70 E | E35: full | F35: VA Av
E38: |Cw-J| | F38: Vw
E39: ¾Vw | F39: Ve | G39: (same ratio as Champs-Élysées: Arc de Triomphe to Matignon to Place de la Concorde)
B40: Cw | D40: E | E40: Ve | F40: L
B41: L | D41: N/S | E41: full | F41: 12th St E
B42: mid L,Ce | D42: N | E42: ¼ Ve | F42: T
B43: mid L,Ce | D43: S | E43: ¼ Ve | F43: S | G43: (therefore: |T-S| = ½ Ve)
B44: T | C44: S | D44: N/S | E44: full | F44: 5th St E
B45: L | C45: S | D45: [S 64 W] | F45: NC Av
B46: L | C46: T | D46: N 64 W | E46: full | F46: MA Av | G46: (this is a long road, it curves left about 2 degrees on the way NW)
B47: Ce | C47: S | D47: S 64 E | E47: full | F47: PA Av (east)
B48: Ce | C48: T | D48: N 64 E | E48: full | F48: MD Av (east)
B50: T | D50: E/W | E50: full | F50: C St
B52: MA Av & 8th St | D52: E/W | E52: full | F52: K St
B54: Cw | D54: [S 14 W] | E54: full | F54: DE Av SW | G54: (aim directly towards Alexandria, Virginia, viewed down the Potomac)
B55: Ce | D55: N 14 E | E55: K St | F55: DE Av NE
B56: Cw | D56: N 14 W | E56: K St | F56: NJ Av NW
B57: Ce | D57: S 14 E | E57: full | F57: NJ Av SE
B58: Wn | D58: N | E58: b
B59: NJ Av | D59: W | E59: full | F59: G St
B61: DE Av & MA Av | D61: S | E61: NJ Av | F61: 1st St E
B62: NJ Av & MA Av | D62: S | E62: DE Av | F62: 1st St
B63: mid 8th St, 1st St | D63: N/S | E63: full | F63: 4½ St
B64: J | C64: 4½ St | D64: N 70 E | F64: IN Av (west)
B65: IN Av & 4½ St | C65: NJ Av | D65: S 70 E | F65: IN Av (east)
B66: IN Av & 4½ St | D66: E/W | E66: full | F66: D St
B68: Wn | C68: MA Av & 8th St | D68: N 64 E | E68: full | F68: NY Av (east)
B69: Wn | D69: N 64 W | E69: full | F69: PA Av (west)
B70: Wn | C70: perp. MA Av | D70: N 26 E | E70: full | F70: VT Av
B71: Wn | D71: N 26 W | E71: MA Av | F71: CT Av
B72: VT Av & MA Av | D72: N/S | E72: full | F72: 14th St
B73: VT Av & MA Av | D73: E/W | E73: full | F73: M St
B74: CT Av & M St | D74: N 64 E | E74: full | F74: RI Av
B75: CT Av & MA Av | C75: VT Av & RI Av | D75: E | F75: P St
B76: P St west end | D76: N/S | E76: full | F76: 19th St
B77: P St east end | D77: N/S | E77: full | F77: 13th St
B79: PA Av & K St | D79: N/S | E79: full | F79: 23rd St
B81: MA Av & RI Av | D81: E/W | E81: full | F81: N St
B83: CT AV & K St | D83: S | E83: full | F83: 17th St (south)
B84: VT Av & K St | D84: S | E84: full | F84: 15th St (south)
B85: PA Av & 19th St | C85: NY Av & 19th St | D85: W | F85: H St (upper)
B87: VT Av & K St | D87: W | E87: b
C88: VT Av | D88: S | E88: full | F88: 15th St (north)
B89: CT AV & K St | D89: E | E89: b
C90: CT Av | D90: S | E90: full | F90: 17th St (north)
B91: VT Av & 15th St (north)
B92: PA Av | C92: NY Av | D92: E/W | F92: I St (upper)
B94: H St (upper) & 13th St | D94: S | E94: b
B95: NY Av | C95: MA Av | D95: W | F95: H St (lower right)
B96: NY Av & H St (lower right) | D96: N/S | E96: full | F96: 3rd St
B98: NY Av & I St (upper) | D98: S | E98: b
B99: NY Av | C99: MA Av | D99: W | F99: I St (lower)
B100: NY Av & I St (lower) | D100: N/S | E100: full | F100: 5th St
B101: 5th St | D101: E | E101: 2 x dist to 4½ St
D102: N/S | E102: full | F102: 4th St
B103: mid I St (upper) & I St (lower) | C103: NY Av | D103: N/S | E103: full | F103: 11th St
B104: NY Av & 5th St
B105: 11th St | C105: 4th St | D105: E | F105: L St (upper)
B106: L St (upper) & 11th St | D106: S | E106: 2 x dist to MA Av
B107: MA Av | D107: W | E107: full | F107: L St (lower left)
B109: NY Av & 4½ St | D109: S | E109: 2 x dist to L St (upper)
D110: W | E110: full | F110: L St (lower right)

Sheet: Sheet5
A1: TODO: check pencil line NW from D St & 5th St E
A4: N/S (numbered) streets (from E to W) (“West” unless specified as E meaning “East”)
B5: north end | C5: south end | E5: TODO? | F5: distance at Capitol Av (pixels)
A6: 12th E
A7: 5th E
A8: 1st E | B8: MA | C8: NJ
A9: Capitol
A10: 1st | B10: MA | C10: DE | F10: 204
A11: 2nd | F11: 0
A12: 3rd | F12: 196 | G12: *
A13: 4th
A14: 4½
A15: 5th | F15: 188 | G15: of:=[.F15]/([.F15]+[.F17]) -> 0.425339366515837 | H15: ~(3/7) | I15: ~420 feet | J15: ~277 feet today
A16: 6th | E16: X | F16: 0
A17: 7th | F17: 254 | I17: ~568 feet | J17: ~563 feet today
A18: 8th
A19: 9th | F19: 195 | G19: *
A20: 10th | F20: 0
A21: 11th | F21: 195 | G21: *
A22: 13th
A23: 14th
A24: 15th (lower) | B24: K
A25: 15th (upper) | C25: I (upper)
A26: 16th | C26: Wn
A27: 17th (upper) | C27: I (upper)
A28: 17th (lower) | B28: K
A29: 18th (upper) | C29: M | D29: nonexistent today
A30: 18th
A31: 19th | F31: @ K St | G31: @ L St | H31: @ M St
A32: 21st | F32: 433 | G32: 435 | H32: 434
A33: 23rd | F33: 164 | G33: 161 | H33: 167
A34: 24th | E34: X | F34: ^ | G34: ^ | H34: ^ | I34: ~367 feet | J34: ~372 feet today
A36: E/W (lettered) streets (from S to N) (“North”)
B37: west end | C37: east end
A38: Capitol | B38: J
A39: C | B39: 15th (lower)
A40: D | B40: 15th (lower)
A41: E | B41: 15th (lower)
A42: F
A43: G | C43: NJ
A44: G (upper) | B44: NJ
A45: H (lower left) | B45: 23rd | C45: PA
A46: H (lower right) | B46: NY | C46: MA
A47: H (upper) | B47: PA | C47: NY
A48: I (lower) | B48: NY | C48: MA
A49: I (upper) | B49: PA | C49: NY
A50: K
A51: L (lower left) | C51: MA
A52: L (lower right) | B52: NY
A53: L (upper) | B53: 11th | C53: 4th
A54: M
A55: N | B55: 23rd
A56: P | B56: CT | C56: VT
A58: (no avenues left TODO)
A60: other notes:
A61: 13 avenues
A62: 13 parks | B62: of which:
B63: 1 circular
B64: 2 elongated

Sheet: Sheet3
A1: https://lccn.loc.gov/88694196 | B1: 1850
A2: https://lccn.loc.gov/87694263 | B2: 1792 over 1914
A3: https://lccn.loc.gov/88694205 | B3: 1791 (late)
A4: https://lccn.loc.gov/88690916 | B4: Mall 1791 (1901)
A5: https://lccn.loc.gov/88690863
A6: https://lccn.loc.gov/91683176
A7: https://lccn.loc.gov/87694240
A8: https://lccn.loc.gov/88693174
A9: https://lccn.loc.gov/88694209
A10: https://lccn.loc.gov/88694130
A11: https://lccn.loc.gov/91684423
A12: https://lccn.loc.gov/87694246
A13: https://lccn.loc.gov/87694269
A14: https://lccn.loc.gov/94681713
A16: https://www.cnu.org/publicsquare/2018/02/21/l%E2%80%99enfant%E2%80%99s-sacred-design-washington-dc
A22: https://archive.org/details/elementseuclidi00douggoog/page/n221/mode/2up
A23: look up log by “200”: 3010300
A24: https://archive.org/details/elementseuclidi00douggoog/page/n263/mode/2up
A25: look up nearest tan: 26° 34′
A26: Use that angle to compute headings
A27: from Ce (N 63° 26′ E)
A28: from L (N 63° 26′ W)

Sheet: Sheet4
A1: All readings are in pixels, unless otherwise stated
A3: Wn
A4: W | C4: ^ | G4: ^
A5: Ws | B5: 1730 | C5: 8th St | D5: 1773 | G5: Cap Av | K5: ← F St →
C6: v | G6: v | K6: 611
A7: 1250 | K7: T
K8: 620
A9: J | B9: 1728 | D9: 1775 | G9: C | H9: 43 | I9: Ce | J9: 1263 | K9: ← Cap Av → | L9: 1248 | M9: L
K10: 635
K11: S
A14: calculated ratio of pixels to feet | B14: of:=2.235 -> 2.235
E16: Cw | F16: 29 | G16: C | H16: of:=[.H9] -> 43 | I16: Ce
E17: Cwn | F17: 43 | G17: Nominal | H17: 43
A18: Chris Mosher’s “¾ length of Mall” hypothesis:
A19: |Cwn-Ce| | B19: of:=[.F17]+[.H17] -> 86
A20: width of Capitol in feet | B20: of:=[.B19]*[.B14] -> 192.21
A21: |J-8|+Cwn | B21: of:=[.B9]+[.F17] -> 1771
A22: |Ce-L| / |T-S| | B22: of:=([.J9]+[.L9])/([.K8]+[.K10]) -> 2.000796812749
A24: |J-Cwn| | B24: of:=[.B9]+[.D9]-[.F17] -> 3460
A25: ¾ |J-Cwn| | B25: of:=(3/4)*[.B24] -> 2595
A26: |L-Cwn| | B26: of:=[.L9]+[.J9]+[.H17]+[.F17] -> 2597
A27: absolute error | B27: of:=[.B25]-[.B26] -> -2
A32: “Sacred Disign” hypothesis:
A33: 1st St W & MA Av | B33: 3269
B34: ^
A35: 1st St E & MA Av | B35: 2492 | F35: |Ce-L| | G35: of:=[.J9]+[.L9] -> 2511 | H35: abs error: | I35: of:=[.B35]-[.G35] -> -19
B36: ^
B37: L
A42: BEST:
A43: h = distance on 8th street from intersection of Indiana Ave and Pennsylvania Ave, to C St
A44: h | B44: 626
A45: then distance from Ce to L is 4h
A46: 4h | B46: of:=[.B44]*4 -> 2504
A47: |Ce-L| | B47: of:=[.L9]+[.J9] -> 2511
A48: diff | B48: of:=[.B46]-[.B47] -> -7